{
"situation":"You noticed that parts of northern Europe have milder winters than places in Canada at similar latitudes, and you want to know why. The usual one-word answer is the Gulf Stream, but it is unclear how much work the ocean does compared with the winds, the land, and the sea ice. What also stays open is which Canadian place you have in mind, since Canada's west coast, interior, and Labrador coast behave very differently.",
"minds":[
{"title":"The Ocean Plumber","concern":"Heat has to come from somewhere, and the great ocean currents are the delivery system.","author":"Matthew Fontaine Maury","book":"The Physical Geography of the Sea","year":1855},
{"title":"The Land-and-Air Skeptic","concern":"Climate follows the contrast between sea and land and the direction of the wind, not latitude alone.","author":"Alexander von Humboldt","book":"Cosmos","year":1845},
{"title":"The Ice-Core Reader","concern":"The ocean circulation is not a fixed fact; the past shows it can change fast, and that changes what we can safely assume.","author":"Richard B. Alley","book":"The Two-Mile Time Machine","year":2000}
],
"debate":[
{"speaker":"The Ocean Plumber","text":"Start with the obvious. Bergen sits around sixty north and its harbor stays open all winter, while the Labrador coast at the same latitude is ice for months. Warm water streams up from the tropics and keeps going. It is a heating pipe for a whole coastline.","author":"Matthew Fontaine Maury","book":"The Physical Geography of the Sea","pd":true,"basis":"Basis: Matthew Fontaine Maury, The Physical Geography of the Sea"},
{"speaker":"The Land-and-Air Skeptic","text":"A pipe needs a radiator. Water does not warm your face; air does. And Vancouver is mild in winter with no Gulf Stream anywhere near it. If one mechanism explains Bergen and Vancouver, maybe it is the sea meeting the prevailing westerly wind, and your current is only one case of it.","author":"Alexander von Humboldt","book":"Cosmos","pd":true,"basis":"Basis: Alexander von Humboldt, Cosmos"},
{"speaker":"The Ocean Plumber","text":"Vancouver hurts my claim that the Gulf Stream is the whole story, and I will narrow it. But winds with nothing warm underneath have nothing to deliver. The North Atlantic is unusually warm for its latitude, and that is the current's doing. Wind carries it; the current stocks it.","author":"Matthew Fontaine Maury","book":"The Physical Geography of the Sea","pd":true,"basis":"Basis: Matthew Fontaine Maury, The Physical Geography of the Sea"},
{"speaker":"The Land-and-Air Skeptic","text":"Stocked, yes, but notice what the sea really does: it cools slowly. A big body of water gives back heat all winter, while the Canadian interior loses it fast under clear skies and snow. Humboldt's lines of equal temperature bend with land and sea, not with latitude. I would add, beyond Humboldt, that cold air spilling off the continent onto Canada's east coast does the rest.","author":"Alexander von Humboldt","book":"Cosmos","pd":true,"basis":"Basis: Alexander von Humboldt, Cosmos"},
{"speaker":"The Ice-Core Reader","text":"You are both arguing over shares as if the shares were fixed. Ice records show the North Atlantic has flipped between modes fast in the past, with big cold swings around it. So whatever the ocean contributes, it is a contribution that can change, and that is the part I would not leave out.","author":"Richard B. Alley","book":"The Two-Mile Time Machine","pd":false,"basis":"Basis: Richard B. Alley, The Two-Mile Time Machine"},
{"speaker":"The Ocean Plumber","text":"Then you have helped me. If the winds did nearly everything, why would a change in the ocean circulation matter that much to Europe's winters? The ice record points to the current being a real lever, not decoration.","author":"Matthew Fontaine Maury","book":"The Physical Geography of the Sea","pd":true,"basis":"Basis: Matthew Fontaine Maury, The Physical Geography of the Sea"},
{"speaker":"The Land-and-Air Skeptic","text":"Not so fast. When the ocean cools, sea ice can spread and seal the water off from the air, and then the warm sea cannot heat anything. So the lever may work through the air-sea contact, which is my territory. I concede the ocean matters; I still doubt it matters as a pipe.","author":"Alexander von Humboldt","book":"Cosmos","pd":true,"basis":"Basis: Alexander von Humboldt, Cosmos"},
{"speaker":"The Ice-Core Reader","text":"I will limit myself too. Past abrupt shifts show the system can change, not that it will change soon or by how much for any one town. And the size of each factor is still argued by experts, so I will not hand you a number. Also, you might be asking from curiosity about a puzzle on the map, or because you are thinking of moving or traveling, or because you worry about a changing climate. Each would make a different part of this answer matter most.","author":"Richard B. Alley","book":"The Two-Mile Time Machine","pd":false,"basis":"Basis: Richard B. Alley, The Two-Mile Time Machine"},
{"speaker":"The Ocean Plumber","text":"The fact that would reorder things most is which Canada. If it is the Pacific coast, the Skeptic's sea-and-westerlies story already explains the mildness and the Gulf Stream is beside the point. If it is Labrador or the Atlantic side, the cold Labrador Current and the cold winds off the continent make my warm-pipe contrast sharper. If it is the interior, distance from any sea settles it.","author":"Matthew Fontaine Maury","book":"The Physical Geography of the Sea","pd":true,"basis":"Basis: Matthew Fontaine Maury, The Physical Geography of the Sea"},
{"speaker":"The Land-and-Air Skeptic","text":"And what does warmer mean? Average winter temperature, or how often it plunges? Mild averages with fewer deep cold snaps is a sea-and-wind signature. I will take that win and leave you the current as a supporting actor, which is more than I intended to give.","author":"Alexander von Humboldt","book":"Cosmos","pd":true,"basis":"Basis: Alexander von Humboldt, Cosmos"},
{"speaker":"The Ice-Core Reader","text":"So where we still differ is the share each deserves, and whether the current is a pipe, a stabilizer, or a switch. Everyone here agrees the answer is a partnership, and that the partnership is not guaranteed forever.","author":"Richard B. Alley","book":"The Two-Mile Time Machine","pd":false,"basis":"Basis: Richard B. Alley, The Two-Mile Time Machine"}
],
"clearer":"The main insight is that the question has no single cause: warm Atlantic water, the sea's slow release of heat into prevailing westerly winds, and cold continental air over Canada work together, and the Pacific coast of Canada shows the sea-and-wind part works without the Gulf Stream. What remains disputed is how much each factor deserves and whether the current mainly delivers heat or mainly keeps the system stable. One possible self-reflection is whether you were looking for a single villain or hero in the map, and whether a layered explanation satisfies you better.",
"dependsOn":"If you mean Canada's Pacific coast, the sea-and-westerlies explanation is enough, because it is mild there for the same reason it is in western Europe, with no Gulf Stream involved. If you mean Labrador or the Atlantic side, the warm North Atlantic water contrasts most sharply with cold currents and cold continental winds, so the ocean's role grows. If you mean the interior, distance from the sea and fast winter cooling over land explain most of it. If you want to know how fragile any of this is, the unknown is how stable the North Atlantic circulation is, and a proportionate way to learn it is to look at what ocean and climate researchers say about past shifts and current monitoring, rather than relying on a single story."
}
