{"situation":"You started three new skincare products about a week ago and your face now stings. You know the timing and the symptom; you have not said whether the sting comes the moment a product goes on or hours later, whether it also happens with plain water, or whether the products share ingredients. That detail is the decisive unknown, and the discussion treats each possible answer as its own branch.","minds":[{"title":"The Experimenter","concern":"Turning a hunch into a test that could prove it wrong, so the answer is earned rather than guessed.","author":"Karl Popper","book":"The Logic of Scientific Discovery","year":1934},{"title":"The Harm Minimizer","concern":"Doing less: removing stressors before adding fixes, because well-meant intervention often causes the damage.","author":"Nassim Nicholas Taleb","book":"Antifragile","year":2012},{"title":"The Coincidence Doubter","concern":"Separating things that merely arrive together from things that cause one another.","author":"David Hume","book":"A Treatise of Human Nature","year":1739}],"debate":[
{"speaker":"The Experimenter","text":"Stop all three tonight. Keep only a gentle cleanser and a plain moisturizer you already tolerated. Then bring products back one at a time. A guess about the culprit is worth something only if a test could show it wrong, and this one can.","author":"Karl Popper","book":"The Logic of Scientific Discovery","pd":false,"basis":"Basis: Karl Popper, The Logic of Scientific Discovery"},
{"speaker":"The Harm Minimizer","text":"Agreed on stopping, and I would go further than Taleb here. Subtracting is the treatment. The tempting move is adding a soothing serum, a calming mask, a fourth product. That is the classic intervention that does more harm than the problem it was meant to fix.","author":"Nassim Nicholas Taleb","book":"Antifragile","pd":false,"basis":"Basis: Nassim Nicholas Taleb, Antifragile"},
{"speaker":"The Coincidence Doubter","text":"Slow down. Three products started in the same week, and we are already assuming one of them did it. Things arriving together is not the same as one causing the other. A cold wind, a new pillowcase, shaving, stress, or a hot shower all arrived that week too.","author":"David Hume","book":"A Treatise of Human Nature","pd":true,"basis":"Basis: David Hume, A Treatise of Human Nature"},
{"speaker":"The Experimenter","text":"Fair, and that is exactly why stopping is the test. If the sting fades once the products stop, the products or something that stopped with them are implicated. If it does not fade, the products are cleared and we look elsewhere. But I concede this only points at the group, not a single culprit.","author":"Karl Popper","book":"The Logic of Scientific Discovery","pd":false,"basis":"Basis: Karl Popper, The Logic of Scientific Discovery"},
{"speaker":"The Harm Minimizer","text":"Then your schedule needs a fix. Putting a suspect back onto stinging skin can prolong the damage, and you will learn nothing clean from irritated skin anyway. Wait until the skin is calm, which may be longer than a few days. Also, the culprit may be the combination, not any one product.","author":"Nassim Nicholas Taleb","book":"Antifragile","pd":false,"basis":"Basis: Nassim Nicholas Taleb, Antifragile"},
{"speaker":"The Experimenter","text":"Conceded: calm first. But waiting without a rule is just avoidance. Set a finish line, such as the plain moisturizer going on without any sting for several days. And a combination is still testable: reintroduce singly first, then pair them. Pairs are the hypothesis you keep for last.","author":"Karl Popper","book":"The Logic of Scientific Discovery","pd":false,"basis":"Basis: Karl Popper, The Logic of Scientific Discovery"},
{"speaker":"The Coincidence Doubter","text":"The fact that would most reorder this is how it stings. If it burns the instant anything touches your face, even plain water, that points to a stressed skin barrier and a too-much-too-fast story, so rest wins. If one product stings on contact and the others do not, that one goes first. If redness, itching, or a rash shows up hours later, that is a different kind of reaction and deserves a professional look.","author":"David Hume","book":"A Treatise of Human Nature","pd":true,"basis":"Basis: David Hume, A Treatise of Human Nature"},
{"speaker":"The Harm Minimizer","text":"One line that is not up for debate: swelling, blistering, hives, spreading rash, eye involvement, or any trouble breathing means stop experimenting and get medical help. A home test is for mild stinging, not for those.","author":"Nassim Nicholas Taleb","book":"Antifragile","pd":false,"basis":"Basis: Nassim Nicholas Taleb, Antifragile"},
{"speaker":"The Coincidence Doubter","text":"Now the harder part: why are you asking? Perhaps you want to rescue products you paid for. Perhaps you fear this is lasting damage. Or someone you trust recommended the routine and you feel pressure to make it work. Rescue favors a slow, careful reintroduction. Fear favors seeing a clinician sooner. Pressure favors giving yourself permission to quit.","author":"David Hume","book":"A Treatise of Human Nature","pd":true,"basis":"Basis: David Hume, A Treatise of Human Nature"},
{"speaker":"The Harm Minimizer","text":"I doubt we can rank those from one sentence, but the phrasing, what is causing it, sounds to me more like worry than a wish to keep the products. I could be wrong. Either way there is a real conflict: keeping the routine versus getting calm skin quickly. That ranking belongs to the person living in the face.","author":"Nassim Nicholas Taleb","book":"Antifragile","pd":false,"basis":"Basis: Nassim Nicholas Taleb, Antifragile"},
{"speaker":"The Experimenter","text":"Then make the test cheap. Keep a short log: date, product, when the sting began, how long it lasted. When skin is calm, try one product on a small patch for a few days before the full face. A log turns a vague feeling into evidence that could prove any of us wrong.","author":"Karl Popper","book":"The Logic of Scientific Discovery","pd":false,"basis":"Basis: Karl Popper, The Logic of Scientific Discovery"}
],"clearer":"The main insight is that the question has two parts: first, get the skin calm by removing stressors; second, work out which stressor mattered, using one change at a time. What stays disputed is how long to wait before reintroducing anything, and whether the cause is one product or the combination. A possible self-reflection: when you picture the answer, are you hoping to save the products, to reassure yourself, or to be done with the routine?","dependsOn":"If the sting happens on contact with anything, even plain water, a barrier-stress explanation is more reasonable, because the skin is reacting to many things; resting on a minimal routine comes first and reintroduction waits. If one product stings on contact and the others do not, that product is the leading suspect, because the timing links it directly; stop it and reintroduce the others singly once calm. If redness, itching, a rash, or delayed swelling appears, a professional opinion becomes more reasonable than self-testing, because that pattern may be an allergic-type reaction. Any swelling, blistering, hives, eye involvement, or breathing trouble means getting medical care right away. If the sting persists after a week or two on a plain routine, the products may be cleared and other causes become more plausible, so a clinician is a proportionate next step. The decisive unknown, how and when it stings, can be learned cheaply with a simple log and a calm-skin patch test."}
