{"situation":"You are watching friends reach milestones such as buying homes and getting married, and you feel behind even though you are unsure you want those things. The tension is between a feeling of lagging and a doubt about whether the race is yours. What remains unknown is whether any part of those milestones appeals to you, or whether the discomfort is about something nearby, such as belonging, security, or time with friends.","minds":[{"title":"The Borrowed-Desire Detective","concern":"Whether the wanting is really yours or caught from the people around you.","author":"René Girard","book":"Deceit, Desire, and the Novel","year":1961},{"title":"The Forecaster","concern":"People predict their own future happiness badly, so check the evidence from people who have lived each path.","author":"Daniel Gilbert","book":"Stumbling on Happiness","year":2006},{"title":"The Experimenter","concern":"A life should be tested and chosen, not inherited by default, and trials should stay small and reversible.","author":"John Stuart Mill","book":"On Liberty","year":1859}],"debate":[{"speaker":"The Borrowed-Desire Detective","text":"Behind implies a finish line, and nobody here agreed to one. Your friends have not shown you something you want. They have shown you something other people want, and wanting spreads like a yawn. The ache may be the contagion, not the desire.","author":"René Girard","book":"Deceit, Desire, and the Novel","pd":false,"basis":"Basis: René Girard, Deceit, Desire, and the Novel"},{"speaker":"The Forecaster","text":"That is tidy, maybe too tidy. Perhaps part of you does want a home or a partner and the doubt is fog. People are poor at predicting what will satisfy them, including predicting that they will not care. Do not trust a feeling in either direction.","author":"Daniel Gilbert","book":"Stumbling on Happiness","pd":false,"basis":"Basis: Daniel Gilbert, Stumbling on Happiness"},{"speaker":"The Experimenter","text":"Mill argued that people should treat their lives as \"experiments of living\", and that following custom merely because it is custom is not choosing at all. But an experiment needs a hypothesis. I am not sure is not one yet, so let us make it testable.","author":"John Stuart Mill","book":"On Liberty","pd":true,"basis":"Basis: John Stuart Mill, On Liberty"},{"speaker":"The Borrowed-Desire Detective","text":"Fair, though beware whom you ask. The Forecaster wants reports from people who did the thing, but their answers are bent by sunk cost and by needing their choice to have been right. Admirers are not neutral witnesses. They are also imitating someone.","author":"René Girard","book":"Deceit, Desire, and the Novel","pd":false,"basis":"Basis: René Girard, Deceit, Desire, and the Novel"},{"speaker":"The Forecaster","text":"Then widen the sample. Ask the married, the single, the ones who left, and the ones who never wanted it. And separate the thing from the feeling it promises. A home might stand in for security, a wedding for being chosen. Those goods may be reachable by other roads.","author":"Daniel Gilbert","book":"Stumbling on Happiness","pd":false,"basis":"Basis: Daniel Gilbert, Stumbling on Happiness"},{"speaker":"The Experimenter","text":"That splits the question usefully: the label versus the goods behind it. Then run small, reversible trials. Rent another year, spend a month of weekends in your friends' homes, date without a plan attached. Cheap tests beat a verdict reached by dread.","author":"John Stuart Mill","book":"On Liberty","pd":false,"basis":"Basis: John Stuart Mill, On Liberty"},{"speaker":"The Borrowed-Desire Detective","text":"Danger there. Trials can become auditions for the same script, a life designed by someone else with you as the understudy. A better first experiment points away from the script: notice what you envy when nobody is watching, and see if it matches any milestone at all.","author":"René Girard","book":"Deceit, Desire, and the Novel","pd":false,"basis":"Basis: René Girard, Deceit, Desire, and the Novel"},{"speaker":"The Experimenter","text":"I will take the second half and reject the first. Withdrawing from friends is also an experiment, and it has a cost. Envy is data, not a verdict. Maybe behind is really lonely, because your friends' attention is moving to new households while yours stays put.","author":"John Stuart Mill","book":"On Liberty","pd":false,"basis":"Basis: John Stuart Mill, On Liberty"},{"speaker":"The Forecaster","text":"That reframing matters. The real loss may be shared time, not a milestone, and shared time is fixable without a mortgage. I would add a caution: indefinite waiting is not neutral. Some goods have windows, so not wanting should be checked against the calendar, not assumed.","author":"Daniel Gilbert","book":"Stumbling on Happiness","pd":false,"basis":"Basis: Daniel Gilbert, Stumbling on Happiness"},{"speaker":"The Borrowed-Desire Detective","text":"I concede that. Some deadlines are real, such as biology or a housing market, and the feeling of being behind should not outvote them. My narrower claim: the feeling tells you almost nothing about what you want. The calendar facts do tell you something, and they can be checked.","author":"René Girard","book":"Deceit, Desire, and the Novel","pd":false,"basis":"Basis: René Girard, Deceit, Desire, and the Novel"},{"speaker":"The Experimenter","text":"Then we agree on less than we pretended, and that is fine. A life that skips these milestones can be as legitimate as one that hits them. The difference I care about is whether it was tried and chosen, or simply arrived at because the alternative felt embarrassing.","author":"John Stuart Mill","book":"On Liberty","pd":false,"basis":"Basis: John Stuart Mill, On Liberty"}],"clearer":"The main insight is that the feeling of being behind and the question of what you want are separate signals, and the first may say little about the second. It may point instead at something nearby, such as shared time with friends, security, or being chosen. What remains disputed is how much to trust your own present doubt, since the Forecaster treats it as unreliable evidence while the Detective treats it as possibly your most honest signal. A possible self-reflection: when you picture the milestone itself, versus the feeling it would bring, which of the two draws you, and does anything you envy have nothing to do with the script?","dependsOn":"If, when you picture the actual life (the home, the partnership), something in it appeals to you more than the status of having it, then a small, reversible trial of that piece becomes more reasonable, because the Forecaster and the Experimenter both say lived evidence beats guessing. If what stings is mostly losing time with friends as their lives shift, then addressing connection directly becomes more reasonable than pursuing milestones, because the goal and the road have come apart. If you notice the pull is strongest when you are comparing yourself and fades when you are alone, the Detective's reading gains weight and the milestone is less likely to be your own wish. If some goods you might want have real time limits, such as having children, that is the decisive fact to learn early; a proportionate way is to look up the actual constraints and talk with a few people on different paths, including some who chose none of these."}