{"situation":"Your face started stinging within a week of adding three new skincare products at once, and you want to know which one is responsible. Because all three arrived together, the data so far cannot point to any single product. What matters most and is not yet known: how severe the reaction is, whether it fades after rinsing, and whether anything else changed that week.","minds":[{"title":"The Controlled Tester","concern":"Isolating one change at a time so the cause can actually be identified.","author":"John Stuart Mill","book":"A System of Logic","year":1843},{"title":"The Subtractor","concern":"Removing stressors first and favoring the safest move when skin is already inflamed.","author":"Nassim Nicholas Taleb","book":"Antifragile","year":2012},{"title":"The Story Skeptic","concern":"Guarding against the neat but wrong explanation, and against unreliable memory of what happened.","author":"Daniel Kahneman","book":"Thinking, Fast and Slow","year":2011}],"debate":[{"speaker":"The Controlled Tester","text":"Three products started together, so nothing can be blamed yet. The only clean method is to change one thing at a time and hold everything else steady. Stop all three, let the skin settle, then add them back one by one, days apart. The one that brings back the sting is your answer.","author":"John Stuart Mill","book":"A System of Logic","pd":true,"basis":"Basis: John Stuart Mill, A System of Logic"},{"speaker":"The Subtractor","text":"I'd slow that down. Reintroducing products is more experimenting on skin that is already angry. First subtract: gentle cleanser, plain moisturizer, nothing else. Removing a possible irritant rarely costs anything. I'd say testing only makes sense once the skin is calm, and that timing is my own addition to Taleb.","author":"Nassim Nicholas Taleb","book":"Antifragile","pd":false,"basis":"Basis: Nassim Nicholas Taleb, Antifragile"},{"speaker":"The Story Skeptic","text":"You both assume a product is guilty. The newest thing is just the easiest suspect. A hotter shower, a new detergent, cold wind, or two of these products fighting each other could produce the same sting. The mind loves a tidy culprit, and tidy is not the same as true.","author":"Daniel Kahneman","book":"Thinking, Fast and Slow","pd":false,"basis":"Basis: Daniel Kahneman, Thinking, Fast and Slow"},{"speaker":"The Controlled Tester","text":"That is exactly why everything else gets held constant and written down. But you've landed a real hit: if two products only irritate together, testing them singly will miss it. So my plan narrows. Test each alone, then the pairs, and admit that joint causes are the hardest case for my method.","author":"John Stuart Mill","book":"A System of Logic","pd":true,"basis":"Basis: John Stuart Mill, A System of Logic"},{"speaker":"The Subtractor","text":"Here is what I notice. The question is how to find the cause, not whether to stop using them. Perhaps the person paid for these and hopes the routine can be saved, so they want a culprit rather than a clean break. If so, the hard advice is to drop the lot for now.","author":"Nassim Nicholas Taleb","book":"Antifragile","pd":false,"basis":"Basis: Nassim Nicholas Taleb, Antifragile"},{"speaker":"The Story Skeptic","text":"That reading is possible, but nothing in their words mentions money. A stinging face is alarming, and asking what is causing it fits plain worry just as well: is this an allergy, is my skin damaged? If that's the pressure, reassurance and warning signs matter more than rescuing a shelf of bottles.","author":"Daniel Kahneman","book":"Thinking, Fast and Slow","pd":false,"basis":"Basis: Daniel Kahneman, Thinking, Fast and Slow"},{"speaker":"The Controlled Tester","text":"Notice the advice splits on that. If they want to keep the routine, I give a reintroduction schedule, one product at a time. If they mainly fear something serious, the schedule can wait and a short list of red flags comes first. Either way, calm skin comes before any testing.","author":"John Stuart Mill","book":"A System of Logic","pd":true,"basis":"Basis: John Stuart Mill, A System of Logic"},{"speaker":"The Subtractor","text":"Then name the red flags. Swelling of the lips or face, trouble breathing, blisters, a spreading rash, or burning that keeps worsening means urgent medical care, not a home experiment. A mild sting that fades soon after rinsing is a different animal. Waiting around is a bad plan when the skin is burning.","author":"Nassim Nicholas Taleb","book":"Antifragile","pd":false,"basis":"Basis: Nassim Nicholas Taleb, Antifragile"},{"speaker":"The Story Skeptic","text":"Yet panic has a cost too. Stinging from new products is common and is often simple irritation rather than allergy. And in a month, memory will rewrite this week into a clean story. So write today what you used, when it stung, how bad it felt, and what else changed.","author":"Daniel Kahneman","book":"Thinking, Fast and Slow","pd":false,"basis":"Basis: Daniel Kahneman, Thinking, Fast and Slow"},{"speaker":"The Controlled Tester","text":"Good, that note becomes the control record. And once calm, I'd patch test each product on a small spot, like the inner forearm, for a day or two. That gives a far cleaner signal than the face. If the reactions look persistent or unclear, a dermatologist can do proper patch testing.","author":"John Stuart Mill","book":"A System of Logic","pd":true,"basis":"Basis: John Stuart Mill, A System of Logic"},{"speaker":"The Subtractor","text":"I accept patch tests, but I'd go further than Taleb and ask why retest at all. If a product is nonessential, the cost of being wrong outweighs the value of knowing, so just leave it out. We still disagree if the sting came from the product they love most.","author":"Nassim Nicholas Taleb","book":"Antifragile","pd":false,"basis":"Basis: Nassim Nicholas Taleb, Antifragile"}],"clearer":"The main insight is that finding the cause only works after the skin is calm and the other variables are held steady, and that the newest product is a suspect rather than a verdict. What remains disputed is whether to retest at all or simply drop what you do not need. One possible self-reflection: when you ask what is causing it, are you hoping to keep the routine, or mostly to be sure nothing serious is going on? Either could be true, and only you can say.","dependsOn":"If you have swelling, trouble breathing, blisters, a spreading rash, or burning that keeps worsening, seek urgent medical care before any home testing. If the sting is mild and fades after rinsing, stopping the new products and using only a gentle cleanser and plain moisturizer until calm is reasonable, because removing possible irritants costs little. If you want to keep your routine, then once calm, add back one product at a time, a few days apart, with a written log, and test pairs last because interactions can hide from single tests. If you do not need a product, leaving it out may be more sensible than proving it guilty. If the reaction persists, repeats unclearly, or you cannot separate the products, a dermatologist can run proper patch testing, which is a proportionate way to learn what you cannot sort out yourself."}
