{"situation":"The user notices that places in northern Europe, such as Norway, Britain or Ireland, stay much milder in winter than places in Canada at similar latitudes, and asks why. What they know is the temperature contrast; what is left open is which cause does the most work, since several explanations are commonly offered and they overlap: ocean currents, prevailing winds, the heat storage of water, and the shape of the continents.","minds":[{"title":"The Ocean Mapper","concern":"Heat moves in great currents, and the Atlantic delivers warmth northward to Europe.","author":"Henry Stommel","book":"The Gulf Stream","year":1958},{"title":"The Fragility Watcher","concern":"The climate system can sit in one stable mode and flip abruptly, so any single-cause story hides how contingent the mild winters are.","author":"Richard B. Alley","book":"The Two-Mile Time Machine","year":2000},{"title":"The Energy Accountant","concern":"Start from heat budgets, how much a given mechanism can carry, and from how air and water store and move energy.","author":"Raymond T. Pierrehumbert","book":"Principles of Planetary Climate","year":2010}],"debate":[{"speaker":"The Ocean Mapper","text":"The answer is the Gulf Stream and its northern extension. A river of warm water crosses the Atlantic and hands heat to the air above Europe. Canada at the same latitude gets the cold Labrador side of the story. Warm sea, mild coast; cold sea, harsh coast.","author":"Henry Stommel","book":"The Gulf Stream","pd":false,"basis":"Basis: Henry Stommel, The Gulf Stream"},{"speaker":"The Energy Accountant","text":"That is the popular answer, and I think it is too tidy. Warm water only warms Europe if the wind carries that warmth inland. In winter the air over the whole North Atlantic is far colder than the sea, so the sea can give heat to whichever air passes over it. Which way the air blows matters as much as the current.","author":"Raymond T. Pierrehumbert","book":"Principles of Planetary Climate","pd":false,"basis":"Basis: Raymond T. Pierrehumbert, Principles of Planetary Climate"},{"speaker":"The Ocean Mapper","text":"Fair, the wind is the delivery truck. But a truck needs cargo. If the western Atlantic were as cold as the water off Labrador all the way across, the westerlies would arrive cold. My current is where the cargo comes from.","author":"Henry Stommel","book":"The Gulf Stream","pd":false,"basis":"Basis: Henry Stommel, The Gulf Stream"},{"speaker":"The Energy Accountant","text":"Part of the cargo is not even the current. Water holds a huge amount of heat and gives it up slowly, so the ocean stores summer warmth and releases it through winter. Air that crosses the sea arrives softened. Air that crosses a big landmass first, as it does for eastern Canada, arrives with the land chill already in it. I would also say that is my own extension, not a claim about the Gulf Stream.","author":"Raymond T. Pierrehumbert","book":"Principles of Planetary Climate","pd":false,"basis":"Basis: Raymond T. Pierrehumbert, Principles of Planetary Climate"},{"speaker":"The Fragility Watcher","text":"Both of you are describing a steady machine. I distrust that. The northward flow in the Atlantic has not always run the same way, and ice records point to climate states that changed within a human lifetime. Mild winters in Europe may be one stable mode, not a law of nature.","author":"Richard B. Alley","book":"The Two-Mile Time Machine","pd":false,"basis":"Basis: Richard B. Alley, The Two-Mile Time Machine"},{"speaker":"The Energy Accountant","text":"Careful. Using abrupt change to prove the current is the main cause is a leap. If the winds and the ocean heat store do most of the work, then a weaker current would cool Europe less than the old story says. Your fragility is real, but its size is the very thing in dispute.","author":"Raymond T. Pierrehumbert","book":"Principles of Planetary Climate","pd":false,"basis":"Basis: Raymond T. Pierrehumbert, Principles of Planetary Climate"},{"speaker":"The Fragility Watcher","text":"Granted, I cannot size it from memory, and I will not pretend the book does. So I narrow my claim: the mild winters depend on a chain of links, and any one of them can be the weak one. Here is a possible reading of the user. Perhaps they want one clean cause to hold onto, because a single reason feels like understanding.","author":"Richard B. Alley","book":"The Two-Mile Time Machine","pd":false,"basis":"Basis: Richard B. Alley, The Two-Mile Time Machine"},{"speaker":"The Ocean Mapper","text":"I would offer a rival reading that fits the same words. Perhaps the user is bothered by an apparent unfairness, same distance from the pole, very different winters, and wants to see the map that makes it feel less arbitrary. Then a single story is not the goal at all. A picture of where heat comes from and where it goes is.","author":"Henry Stommel","book":"The Gulf Stream","pd":false,"basis":"Basis: Henry Stommel, The Gulf Stream"},{"speaker":"The Energy Accountant","text":"Those readings change what I would say. If they want one cause, I should refuse to give it and say the answer is a shared bill: ocean storage, winds, and a warm current each pay part. If they want the map, I draw heat paths, and the current becomes one arrow among several. Only the user can say which reading is theirs.","author":"Raymond T. Pierrehumbert","book":"Principles of Planetary Climate","pd":false,"basis":"Basis: Raymond T. Pierrehumbert, Principles of Planetary Climate"},{"speaker":"The Fragility Watcher","text":"And under the map reading I get my place back. Once heat has paths, you can ask which path is sturdy and which could be cut. That is a better next question than why is Europe warm: how much of Europe warmth would survive if one link failed?","author":"Richard B. Alley","book":"The Two-Mile Time Machine","pd":false,"basis":"Basis: Richard B. Alley, The Two-Mile Time Machine"},{"speaker":"The Ocean Mapper","text":"I accept a smaller role for my current, but not none. Even as one arrow among several, it is the one that explains why the western Atlantic is not a cold pool. Remove it and the winds have less warmth to deliver. We still disagree on how much, and that is honest.","author":"Henry Stommel","book":"The Gulf Stream","pd":false,"basis":"Basis: Henry Stommel, The Gulf Stream"}],"clearer":"The main insight is that the contrast is not one cause but a partnership: warm Atlantic water, westerly winds that carry its influence over Europe, and the way oceans store heat while big continents let winter air grow very cold. Still disputed is the share each part contributes, especially how much Europe would cool if the current weakened, and the debate did not settle that. A possible self-reflection: does a single clear cause appeal because it feels like understanding, or would a map of how heat travels serve better? That is for the user to judge, not something the debate assumes.","dependsOn":"If the user wants a quick, usable answer, then describing the shared bill (ocean, wind, and heat storage, with the current as one contributor) is more reasonable, because it avoids overstating any single cause. If they want to understand future risk, then asking how sturdy each link is becomes more reasonable, because a weakened current matters only to the degree Europe depends on it. If the decisive unknown is how large the current share is, a proportionate way to learn it is to look for published climate-model comparisons that change the ocean heat transport or the winds while holding the rest fixed, and see how much winter warmth changes."}
